{
  "schema_version": 1,
  "register_id": "quill-divergence-register-contract-fixture",
  "redaction_policy_version": "quill-divergence-redaction-v1",
  "events": [
    {
      "event_type": "observation",
      "event": {
        "header": {
          "sequence": 1,
          "supersedes": null,
          "recorded_by": "contract-fixture-author",
          "recorded_at": "2026-07-27T00:00:00Z"
        },
        "divergence_id": "DIV-900",
        "class": "oversized_query_token",
        "first_seen_artifact_object_hash": "0123456789abcdef",
        "first_seen_artifact_sha256": "aaaaaaaaaaaaaaaaaaaaaaaaaaaaaaaaaaaaaaaaaaaaaaaaaaaaaaaaaaaaaaaa",
        "revisions": {
          "subject_git_revision": "1111111111111111111111111111111111111111",
          "oracle_git_revision": "2222222222222222222222222222222222222222",
          "corpus_manifest_sha256": "bbbbbbbbbbbbbbbbbbbbbbbbbbbbbbbbbbbbbbbbbbbbbbbbbbbbbbbbbbbbbbbb",
          "query_manifest_sha256": "cccccccccccccccccccccccccccccccccccccccccccccccccccccccccccccccc",
          "generator_revision": "frankensearch-synthetic-v2"
        },
        "fixture": {
          "fixture_id": "divergence-register-contract-fixture",
          "fixture_sha256": "dddddddddddddddddddddddddddddddddddddddddddddddddddddddddddddddd",
          "regression_test": "runner::tests::divergence_ledger_schema_fixture_round_trips",
          "minimized": true
        },
        "mismatch_signatures": ["eeeeeeeeeeeeeeeeeeeeeeeeeeeeeeeeeeeeeeeeeeeeeeeeeeeeeeeeeeeeeeee"],
        "observed_behavior": "The subject lowers the synthetic oversized atom to MatchNone.",
        "expected_behavior": "The oracle retains an unmatchable posting-list leaf.",
        "root_cause": "The subject applies its symmetric token-admission bound during AST lowering.",
        "consumer_impact": "Only programmatic AST construction can observe the lowering; results remain equivalent.",
        "diagnostic": {
          "payload_sha256": "ffffffffffffffffffffffffffffffffffffffffffffffffffffffffffffffff",
          "marker": "<redacted:synthetic-query>"
        }
      }
    },
    {
      "event_type": "disposition",
      "event": {
        "header": {
          "sequence": 2,
          "supersedes": null,
          "recorded_by": "contract-fixture-maintainer",
          "recorded_at": "2026-07-27T00:01:00Z"
        },
        "divergence_id": "DIV-900",
        "disposition": {
          "kind": "accepted",
          "equivalence_law": "Both lowerings produce the empty result set for every indexed corpus.",
          "rationale": "The public parser length cap makes this shape unreachable through user query strings.",
          "reviewer": "contract-fixture-reviewer",
          "reviewed_at": "2026-07-27T00:00:30Z"
        }
      }
    },
    {
      "event_type": "prediction",
      "event": {
        "header": {
          "sequence": 3,
          "supersedes": null,
          "recorded_by": "contract-fixture-author",
          "recorded_at": "2026-07-27T00:02:00Z"
        },
        "prediction_id": "PRED-900",
        "class": "oversized_query_token",
        "state": {
          "kind": "declared",
          "rationale": "The contract predicts a programmatic AST lowering difference.",
          "owner": "contract-fixture-author",
          "bead_id": "bd-quill-e6-gauntlet-scale-rm3q.8"
        }
      }
    },
    {
      "event_type": "prediction",
      "event": {
        "header": {
          "sequence": 4,
          "supersedes": 3,
          "recorded_by": "contract-fixture-maintainer",
          "recorded_at": "2026-07-27T00:03:00Z"
        },
        "prediction_id": "PRED-900",
        "class": "oversized_query_token",
        "state": {
          "kind": "observed",
          "divergence_id": "DIV-900",
          "reviewer": "contract-fixture-reviewer",
          "reviewed_at": "2026-07-27T00:02:30Z"
        }
      }
    }
  ]
}
